95,25,19,Silver III,Male,Top,3787986226,1,4.0,3.0,4.0,5.0,3.0,4.0,4.0,4.0,5.0,3.0,3.0,3.0,5.0,3.0,4.0,5.0,4.0,2.0,4.0,4.0,4.0,3.0,4.0,4.0,4.0,3.0,3.0,4.0,4.0,4.0,3.0,4.0,2.0,3.0,3.0,4.0,4.0,3.0,3.0,5.0,1.0,0.0,1.0,1.0,0.0,1.0,1.0,1.0,1.0,1.0,0.0,1.0,1.0,0.0,1.0,0.0,1.0,1.0,1.0,1.0,1.0,1.0,0.0,1.0,0.0,0.0,1.0,1.0,0.0,1.0,1.0,1.0,1.0,1.0,1.0,1.0,7,7,7,6,6,6,7,7,7,7,7,"Mid,Jungle","They communicated well and weren't freaking out when they died. Overall they were calm, collected, and overall nice people.",
96,25,22,Silver I,Male,Jung,3787986226,1,2.0,5.0,3.0,5.0,3.0,5.0,4.0,5.0,2.0,3.0,2.0,4.0,1.0,5.0,1.0,4.0,1.0,5.0,1.0,5.0,2.0,5.0,1.0,5.0,2.0,3.0,1.0,5.0,2.0,4.0,2.0,5.0,1.0,5.0,1.0,5.0,3.0,4.0,2.0,5.0,1.0,1.0,1.0,0.0,1.0,1.0,1.0,1.0,1.0,0.0,1.0,0.0,1.0,1.0,1.0,1.0,1.0,0.0,1.0,1.0,1.0,1.0,1.0,1.0,0.0,1.0,0.0,1.0,0.0,0.0,1.0,1.0,0.0,0.0,0.0,1.0,7,7,7,7,7,4,7,7,7,7,7,"Mid,Top",They knew their role and didnt expect me to carry them. they didnt whine and just focused.,this was fun thanks for letting me play
97,26,24,Platinum II,Male,Mid,5078292916,0,5.0,5.0,2.0,3.0,2.0,4.0,3.0,5.0,3.0,3.0,3.0,2.0,5.0,5.0,2.0,3.0,3.0,4.0,3.0,4.0,4.0,4.0,1.0,4.0,4.0,4.0,2.0,2.0,5.0,5.0,2.0,4.0,3.0,5.0,1.0,5.0,1.0,4.0,1.0,5.0,0.0,1.0,0.0,1.0,1.0,1.0,1.0,1.0,1.0,1.0,0.0,0.0,0.0,1.0,1.0,0.0,1.0,1.0,1.0,1.0,1.0,1.0,0.0,0.0,0.0,0.0,1.0,1.0,0.0,1.0,1.0,1.0,1.0,1.0,1.0,1.0,6,6,5,7,6,7,6,5,6,5,7,"Top,Jungle",They seemed to be very nice and not tilting.,GG WP
98,26,18,Platinum III,Male,Jung,5078292916,0,5.0,5.0,2.0,2.0,3.0,4.0,2.0,4.0,4.0,3.0,2.0,3.0,4.0,4.0,2.0,3.0,4.0,4.0,3.0,4.0,4.0,4.0,1.0,4.0,4.0,4.0,1.0,3.0,5.0,4.0,4.0,3.0,4.0,5.0,2.0,4.0,3.0,4.0,2.0,4.0,1.0,1.0,1.0,1.0,1.0,1.0,0.0,1.0,1.0,1.0,0.0,0.0,0.0,1.0,1.0,1.0,0.0,1.0,0.0,1.0,1.0,1.0,0.0,1.0,1.0,1.0,0.0,1.0,0.0,1.0,1.0,0.0,0.0,1.0,1.0,1.0,5,6,6,6,6,6,5,6,7,6,6,"Mid,Top",They were very encouraging and we jelled well together seeming to want to do the same things and apologising for mistake and not flaming others for theirs,
99,26,23,Platinum IV,Male,Top,5078292916,0,2.0,2.0,2.0,2.0,2.0,5.0,5.0,1.0,3.0,5.0,4.0,3.0,5.0,3.0,4.0,4.0,4.0,3.0,2.0,5.0,4.0,4.0,4.0,5.0,2.0,4.0,3.0,3.0,4.0,2.0,5.0,4.0,2.0,2.0,3.0,5.0,4.0,4.0,2.0,2.0,1.0,1.0,1.0,1.0,0.0,0.0,0.0,1.0,1.0,1.0,1.0,1.0,1.0,1.0,1.0,0.0,1.0,1.0,1.0,1.0,1.0,1.0,1.0,0.0,1.0,1.0,1.0,1.0,0.0,1.0,1.0,1.0,1.0,1.0,1.0,1.0,5,6,5,5,7,5,6,6,5,6,6,Jungle,"He was a good jungler, played well and communicated well too",
100,27,24,Silver III,Male,Jung,5086627673,1,3.0,3.0,2.0,2.0,3.0,3.0,4.0,1.0,2.0,4.0,4.0,3.0,2.0,1.0,4.0,2.0,2.0,3.0,2.0,4.0,4.0,3.0,3.0,2.0,4.0,3.0,4.0,2.0,4.0,2.0,3.0,4.0,2.0,1.0,2.0,3.0,4.0,2.0,2.0,2.0,1.0,1.0,1.0,0.0,1.0,1.0,1.0,1.0,0.0,0.0,0.0,1.0,1.0,0.0,1.0,1.0,1.0,1.0,1.0,1.0,1.0,1.0,1.0,0.0,0.0,0.0,1.0,1.0,0.0,1.0,1.0,1.0,1.0,0.0,1.0,1.0,6,6,6,6,6,4,6,5,6,6,7,Top,he was more open to item change upon suggestion and he set up good plays fitting to his champion,gg
101,27,25,Silver III,Male,Top,5086627673,1,4.0,5.0,2.0,4.0,1.0,5.0,5.0,5.0,2.0,3.0,3.0,3.0,4.0,4.0,1.0,3.0,2.0,1.0,3.0,5.0,3.0,5.0,5.0,3.0,4.0,3.0,2.0,3.0,5.0,3.0,3.0,4.0,1.0,5.0,3.0,5.0,3.0,3.0,3.0,5.0,1.0,1.0,1.0,1.0,0.0,1.0,1.0,1.0,0.0,1.0,1.0,1.0,0.0,1.0,1.0,1.0,0.0,1.0,0.0,0.0,1.0,1.0,0.0,1.0,1.0,0.0,0.0,1.0,0.0,0.0,1.0,1.0,1.0,1.0,0.0,1.0,7,7,7,6,7,7,7,7,7,7,7,"Mid,Jungle",Mostly 3 reasons; 1- they knew how to play around objectives; 2- overall nice comunnications skills; 3- didn't happen we lose but i guess they would now how to play safe,
102,27,30,Silver III,Male,Mid,5086627673,1,4.0,2.0,3.0,3.0,3.0,4.0,4.0,1.0,2.0,4.0,3.0,2.0,3.0,3.0,4.0,4.0,3.0,3.0,4.0,2.0,4.0,3.0,4.0,4.0,4.0,4.0,3.0,2.0,3.0,3.0,4.0,2.0,2.0,2.0,2.0,4.0,2.0,3.0,3.0,2.0,0.0,1.0,1.0,1.0,1.0,0.0,1.0,1.0,1.0,0.0,1.0,0.0,0.0,1.0,1.0,1.0,1.0,1.0,1.0,1.0,1.0,1.0,1.0,1.0,1.0,1.0,1.0,1.0,1.0,1.0,1.0,1.0,0.0,1.0,0.0,1.0,7,7,7,6,7,4,7,7,7,7,7,"Top,Jungle","There was good synergy, we seemed to be on the same page about what the next objective was, there was clear, uncluttered communication about ult timers and objectives, there was no flaming and a pleasant spirit",
103,28,25,Silver IV,Female,Support,5087598225,1,4.0,4.0,5.0,5.0,4.0,2.0,5.0,1.0,5.0,5.0,4.0,5.0,5.0,4.0,5.0,5.0,4.0,2.0,4.0,4.0,4.0,1.0,5.0,4.0,5.0,4.0,4.0,5.0,5.0,4.0,5.0,5.0,2.0,2.0,4.0,2.0,5.0,2.0,4.0,5.0,1.0,1.0,1.0,0.0,0.0,1.0,0.0,1.0,1.0,0.0,1.0,1.0,1.0,1.0,0.0,1.0,0.0,1.0,0.0,1.0,1.0,1.0,0.0,0.0,1.0,1.0,1.0,1.0,0.0,1.0,1.0,1.0,0.0,1.0,1.0,1.0,7,6,7,7,7,6,6,6,6,6,7,"Mid,Top,Bot,Jungle,Support","All my team mates were very friendly, easy going, and easy to talk to! I'd be happy to play with any of them again. ",
104,28,18,Silver II,Male,Bot,5087598225,1,2.0,2.0,2.0,4.0,2.0,4.0,5.0,4.0,2.0,4.0,1.0,4.0,2.0,2.0,1.0,4.0,2.0,2.0,4.0,2.0,4.0,4.0,4.0,4.0,4.0,2.0,1.0,4.0,1.0,4.0,2.0,4.0,2.0,2.0,4.0,4.0,2.0,4.0,2.0,5.0,1.0,1.0,0.0,1.0,1.0,1.0,1.0,1.0,1.0,0.0,1.0,1.0,1.0,1.0,1.0,1.0,1.0,1.0,0.0,0.0,1.0,1.0,0.0,0.0,0.0,1.0,1.0,1.0,1.0,1.0,0.0,1.0,1.0,1.0,1.0,1.0,7,7,6,7,7,6,6,7,6,7,7,"Mid,Top,Bot,Jungle,Support",everyone hard carried and they all seem like nice people,hard stomp so the team wasn't really challenged but we all did well to get ahead early
105,28,28,Silver II,Male,Top,5087598225,1,4.0,4.0,1.0,2.0,5.0,4.0,2.0,1.0,2.0,5.0,2.0,4.0,4.0,4.0,2.0,3.0,4.0,4.0,3.0,3.0,5.0,4.0,1.0,2.0,4.0,4.0,1.0,4.0,5.0,3.0,3.0,2.0,5.0,2.0,1.0,4.0,4.0,4.0,2.0,2.0,1.0,1.0,1.0,1.0,0.0,1.0,0.0,1.0,1.0,1.0,1.0,1.0,0.0,1.0,0.0,0.0,0.0,1.0,1.0,1.0,1.0,1.0,1.0,1.0,0.0,1.0,0.0,1.0,1.0,1.0,1.0,1.0,0.0,0.0,1.0,1.0,7,7,7,7,7,7,7,6,7,6,7,"Mid,Bot,Jungle,Support","Overall, the team were polite, vocal and positive. They also played their roles well. ",
106,28,19,Silver III,Male,Jungle,5087598225,1,3.0,4.0,4.0,3.0,4.0,4.0,4.0,1.0,1.0,2.0,2.0,3.0,3.0,2.0,1.0,5.0,3.0,4.0,5.0,4.0,2.0,2.0,4.0,1.0,3.0,2.0,2.0,4.0,4.0,2.0,4.0,5.0,2.0,1.0,4.0,5.0,2.0,2.0,2.0,1.0,0.0,1.0,1.0,1.0,1.0,1.0,0.0,1.0,1.0,1.0,1.0,1.0,0.0,1.0,0.0,1.0,1.0,1.0,1.0,1.0,1.0,1.0,1.0,1.0,1.0,0.0,1.0,1.0,0.0,1.0,1.0,1.0,1.0,1.0,1.0,1.0,7,7,6,6,6,7,7,7,7,6,7,"Mid,Top,Bot,Jungle,Support",They worked together verry good and we listened to eachother and worked like a real team and play more often i bet if we would keep playing as this team we could hit platinum!,ofcourse if we had known eachother for longer and knew eachother we could play way better but i found this team verry good playing !
107,28,26,Gold III,Male,Mid,5087598225,1,5.0,4.0,4.0,5.0,2.0,2.0,5.0,3.0,2.0,2.0,4.0,3.0,5.0,2.0,2.0,4.0,4.0,1.0,2.0,2.0,4.0,1.0,4.0,3.0,4.0,2.0,2.0,1.0,5.0,1.0,5.0,2.0,2.0,2.0,4.0,4.0,4.0,2.0,2.0,2.0,1.0,0.0,0.0,1.0,0.0,0.0,0.0,0.0,1.0,1.0,1.0,1.0,1.0,0.0,1.0,0.0,0.0,1.0,1.0,1.0,1.0,1.0,1.0,1.0,0.0,1.0,0.0,1.0,0.0,1.0,1.0,1.0,0.0,0.0,0.0,1.0,6,7,6,5,7,6,6,7,6,7,7,"Top,Jungle","I usually play alone, so having some company is really nice.",
108,29,28,Gold 1,Male,Bot,5083511692,1,2.0,4.0,2.0,4.0,2.0,4.0,4.0,1.0,1.0,4.0,4.0,3.0,2.0,2.0,2.0,4.0,2.0,2.0,2.0,4.0,4.0,4.0,4.0,2.0,3.0,2.0,2.0,4.0,4.0,2.0,4.0,4.0,2.0,4.0,2.0,4.0,2.0,5.0,3.0,5.0,0.0,0.0,1.0,1.0,0.0,0.0,1.0,1.0,1.0,1.0,1.0,1.0,0.0,1.0,0.0,1.0,0.0,1.0,0.0,1.0,1.0,1.0,1.0,1.0,0.0,1.0,1.0,0.0,0.0,1.0,1.0,0.0,1.0,0.0,1.0,1.0,6,7,7,6,7,6,6,7,7,7,6,"Jungle,Support","would play with both of them again, atmosphere was decent despite long queue times ( 8 mins) ",
109,29,29,Gold II,Male,Jung,5083511692,1,4.0,5.0,1.0,3.0,4.0,5.0,1.0,3.0,4.0,4.0,1.0,2.0,4.0,5.0,3.0,3.0,5.0,4.0,2.0,3.0,3.0,3.0,3.0,3.0,4.0,4.0,1.0,4.0,3.0,3.0,3.0,3.0,3.0,5.0,1.0,3.0,4.0,4.0,3.0,3.0,1.0,1.0,1.0,1.0,0.0,0.0,0.0,1.0,1.0,1.0,0.0,0.0,1.0,0.0,1.0,1.0,0.0,1.0,0.0,1.0,1.0,1.0,0.0,1.0,1.0,0.0,1.0,1.0,1.0,0.0,1.0,1.0,1.0,0.0,0.0,1.0,7,6,7,6,6,6,6,7,6,6,7,"Bot,Support",They were fun to play with and had a good sense of the game.,
110,29,26,Platinum III,Male,Support,5083511692,1,2.0,3.0,1.0,4.0,1.0,3.0,2.0,3.0,3.0,2.0,4.0,2.0,2.0,2.0,2.0,5.0,3.0,4.0,2.0,3.0,2.0,3.0,4.0,3.0,2.0,3.0,2.0,5.0,2.0,2.0,2.0,4.0,2.0,2.0,3.0,3.0,2.0,3.0,2.0,1.0,1.0,1.0,1.0,1.0,0.0,0.0,0.0,1.0,0.0,0.0,1.0,1.0,1.0,1.0,0.0,1.0,0.0,1.0,1.0,1.0,1.0,1.0,1.0,1.0,1.0,0.0,0.0,1.0,0.0,1.0,1.0,1.0,0.0,0.0,1.0,1.0,5,7,6,7,6,6,6,6,6,6,6,"Bot,Jungle","Fun to play with, talkative, if it was for a amateur scene setting we wouldve to see how work ethics harmonize and if the goals truly align",
111,30,26,Gold III,,Bot,5081662791,1,,,,,,,,,,,,,,,,,,,,,,,,,,,,,,,,,,,,,,,,,,,,,,,,,,,,,,,,,,,,,,,,,,,,,,,,,,,,,7,7,6,7,7,6,6,7,7,7,7,"Jungle,Support","Good communications alongside decent coversation, knowing when to switch to ",
112,30,20,Gold III,Male,Jung,5081662791,1,2.0,5.0,1.0,2.0,3.0,5.0,1.0,5.0,1.0,3.0,3.0,3.0,4.0,5.0,3.0,3.0,2.0,3.0,2.0,5.0,2.0,4.0,2.0,4.0,2.0,4.0,1.0,5.0,5.0,5.0,2.0,4.0,2.0,5.0,2.0,5.0,1.0,3.0,5.0,5.0,1.0,1.0,1.0,0.0,1.0,1.0,0.0,0.0,1.0,0.0,0.0,1.0,1.0,1.0,0.0,0.0,0.0,1.0,0.0,1.0,0.0,1.0,0.0,1.0,1.0,1.0,1.0,1.0,0.0,1.0,1.0,0.0,1.0,0.0,0.0,1.0,7,7,7,7,7,7,7,7,7,7,7,"Bot,Support","nice people, very supportive, easy to talk to.",
113,30,20,Gold III,Male,Support,5081662791,1,4.0,3.0,4.0,1.0,4.0,5.0,5.0,3.0,2.0,5.0,2.0,2.0,1.0,2.0,1.0,5.0,4.0,3.0,1.0,5.0,4.0,2.0,5.0,5.0,2.0,3.0,2.0,5.0,4.0,3.0,2.0,4.0,4.0,2.0,2.0,5.0,1.0,4.0,4.0,5.0,0.0,1.0,1.0,1.0,0.0,1.0,1.0,0.0,1.0,1.0,1.0,1.0,0.0,1.0,0.0,0.0,1.0,1.0,1.0,1.0,1.0,1.0,1.0,1.0,1.0,0.0,1.0,1.0,0.0,1.0,1.0,1.0,1.0,1.0,0.0,1.0,7,7,7,6,6,7,7,7,7,7,7,"Bot,Jungle","First of all, I was support, our bot was skilled, with good knowledge about the game. Didn't feel like one of us decided the calls, we always discussed them. And our mains had good symmetry. Generally, both a really chill bunch, and looking at league from the more fun aspect. I dont want to play league with people that take it too serious. So enjoyed this experience very much.","Really fun arrangement, and hope you got some useful data from this, really looking forward to the end product. :)"
114,31,21,Gold III,Male,Mid,5076790743,1,4.0,5.0,3.0,3.0,1.0,2.0,2.0,5.0,2.0,4.0,3.0,2.0,3.0,5.0,5.0,3.0,3.0,4.0,2.0,3.0,3.0,4.0,4.0,3.0,4.0,3.0,4.0,2.0,4.0,4.0,2.0,2.0,1.0,1.0,3.0,3.0,2.0,3.0,4.0,3.0,0.0,0.0,0.0,1.0,0.0,1.0,0.0,0.0,1.0,1.0,1.0,1.0,1.0,1.0,1.0,1.0,1.0,1.0,0.0,0.0,1.0,1.0,0.0,1.0,0.0,1.0,1.0,1.0,0.0,0.0,1.0,1.0,1.0,0.0,0.0,1.0,6,6,7,4,7,7,7,6,6,7,7,"Top,Bot,Jungle,Support","1, of course, really nice team that focus on objectives and they did not tilt with teammates!",
115,31,28,Gold IV,Male,Bot,5076790743,1,3.0,4.0,5.0,2.0,4.0,4.0,3.0,2.0,4.0,4.0,4.0,3.0,5.0,3.0,2.0,4.0,2.0,5.0,4.0,3.0,4.0,3.0,3.0,5.0,4.0,3.0,2.0,4.0,3.0,3.0,4.0,2.0,2.0,2.0,4.0,3.0,5.0,4.0,2.0,3.0,0.0,1.0,0.0,1.0,0.0,0.0,1.0,1.0,1.0,1.0,1.0,1.0,1.0,1.0,1.0,1.0,1.0,1.0,1.0,1.0,1.0,1.0,1.0,1.0,1.0,1.0,1.0,1.0,1.0,0.0,1.0,1.0,1.0,1.0,1.0,1.0,7,7,7,7,7,6,7,7,6,7,7,"Mid,Top,Jungle,Support",Because they were kind and helped me when I needed.,The experiment was very interesting and would love to do it again
116,31,21,Gold II,Male,Jung,5076790743,1,5.0,5.0,2.0,2.0,2.0,1.0,5.0,5.0,1.0,1.0,5.0,5.0,5.0,5.0,5.0,5.0,5.0,5.0,3.0,5.0,4.0,2.0,5.0,2.0,5.0,5.0,1.0,5.0,5.0,3.0,5.0,5.0,2.0,2.0,4.0,5.0,4.0,2.0,4.0,5.0,0.0,0.0,0.0,1.0,1.0,0.0,0.0,0.0,1.0,1.0,0.0,1.0,1.0,1.0,1.0,1.0,1.0,1.0,0.0,1.0,1.0,0.0,1.0,1.0,1.0,0.0,1.0,0.0,0.0,0.0,0.0,1.0,1.0,1.0,1.0,0.0,7,7,7,7,7,7,7,7,7,7,7,"Mid,Top,Bot,Jungle,Support",They all seem like really lovely people :) chill relaxed and they also play to win!,Send me the study when its done please! Thank you :)
117,31,24,Gold IV,Female,Support,5076790743,1,2.0,5.0,4.0,2.0,5.0,4.0,5.0,2.0,1.0,2.0,2.0,2.0,3.0,4.0,2.0,2.0,2.0,4.0,2.0,2.0,4.0,4.0,4.0,4.0,3.0,2.0,1.0,1.0,2.0,4.0,4.0,1.0,2.0,3.0,4.0,3.0,2.0,5.0,4.0,5.0,1.0,1.0,1.0,1.0,1.0,1.0,1.0,1.0,0.0,1.0,1.0,1.0,1.0,1.0,1.0,0.0,1.0,1.0,0.0,0.0,1.0,0.0,1.0,1.0,0.0,1.0,1.0,1.0,0.0,1.0,1.0,1.0,1.0,1.0,0.0,0.0,7,7,7,7,7,7,7,7,7,7,6,"Mid,Top,Bot,Jungle","Honestly I just play League for fun, they were really fun and I enjoyed my match with them :)",
118,31,21,Silver I,Male,Top,5076790743,1,4.0,4.0,1.0,5.0,4.0,2.0,2.0,5.0,2.0,4.0,1.0,4.0,4.0,4.0,5.0,4.0,4.0,4.0,2.0,2.0,4.0,1.0,2.0,4.0,4.0,1.0,1.0,5.0,4.0,2.0,1.0,4.0,4.0,2.0,2.0,4.0,2.0,4.0,2.0,3.0,1.0,1.0,1.0,1.0,1.0,1.0,1.0,1.0,1.0,0.0,1.0,0.0,0.0,1.0,1.0,1.0,0.0,1.0,1.0,1.0,1.0,1.0,0.0,1.0,0.0,0.0,1.0,1.0,1.0,1.0,1.0,1.0,1.0,1.0,1.0,1.0,6,6,6,6,6,5,6,6,6,5,7,"Mid,Bot,Jungle,Support",Everyone seemed very relaxed and fun to play with. The game went pretty smoothly but it was over fast so we didn't get much time to talk.,
119,32,21,Silver III,Female,Bot,5108557177,1,4.0,2.0,2.0,4.0,4.0,4.0,4.0,4.0,1.0,2.0,2.0,4.0,5.0,2.0,4.0,5.0,2.0,2.0,2.0,5.0,4.0,2.0,5.0,4.0,2.0,2.0,2.0,5.0,4.0,2.0,4.0,4.0,3.0,2.0,2.0,4.0,2.0,4.0,2.0,4.0,1.0,0.0,1.0,1.0,0.0,1.0,1.0,1.0,1.0,0.0,1.0,1.0,1.0,1.0,1.0,1.0,1.0,1.0,1.0,1.0,1.0,1.0,1.0,1.0,0.0,0.0,1.0,0.0,0.0,1.0,1.0,1.0,1.0,1.0,1.0,1.0,6,6,7,7,7,6,6,7,7,7,7,"Mid,Top,Bot,Jungle,Support","Good humour, good communication and good people",
120,32,19,Silver III,Male,Top,5108557177,1,4.0,2.0,2.0,5.0,1.0,4.0,4.0,5.0,2.0,2.0,4.0,3.0,4.0,2.0,3.0,4.0,2.0,3.0,3.0,4.0,2.0,2.0,5.0,4.0,2.0,1.0,3.0,4.0,4.0,2.0,4.0,4.0,2.0,2.0,2.0,5.0,2.0,2.0,4.0,5.0,1.0,1.0,1.0,1.0,1.0,1.0,0.0,1.0,1.0,0.0,1.0,1.0,1.0,1.0,0.0,0.0,0.0,1.0,1.0,0.0,1.0,1.0,1.0,1.0,0.0,1.0,1.0,1.0,0.0,1.0,1.0,1.0,1.0,1.0,1.0,1.0,5,7,4,7,7,7,7,7,7,7,7,"Mid,Bot,Jungle,Support","The game was very fun as a whole. We didn't always share the same task priority, but it expressed itself in a joking manner (such as ""guys there's a ward, kill the ward"" ""But there's an Ornn, I want to kill the Ornn""). it felt fun to play together and laugh about greeding for towers, kills, and going for random plays that ended up working out pretty well. I'd honestly play together with any of them again, but Jungle and Support were especially fun",these games is why league is enjoyable
121,32,20,Silver IV,Male,Jung,5108557177,1,5.0,2.0,1.0,5.0,5.0,5.0,5.0,1.0,4.0,3.0,4.0,5.0,5.0,3.0,5.0,4.0,5.0,4.0,1.0,5.0,5.0,3.0,1.0,4.0,5.0,4.0,4.0,4.0,1.0,4.0,2.0,5.0,5.0,2.0,1.0,5.0,1.0,5.0,3.0,2.0,0.0,1.0,1.0,1.0,1.0,0.0,1.0,1.0,1.0,1.0,1.0,1.0,0.0,1.0,1.0,1.0,1.0,1.0,1.0,1.0,1.0,1.0,1.0,1.0,1.0,1.0,1.0,1.0,0.0,1.0,1.0,1.0,1.0,1.0,1.0,1.0,7,7,7,6,7,7,7,7,7,7,7,"Mid,Top,Bot,Jungle,Support",They were positive and took setbacks in their stride.,Oli is a nice person and deserves good internet.
122,32,26,Gold III,Male,Mid,5108557177,1,5.0,4.0,4.0,5.0,2.0,2.0,5.0,3.0,2.0,2.0,4.0,3.0,5.0,2.0,2.0,4.0,4.0,1.0,2.0,2.0,4.0,1.0,4.0,3.0,4.0,2.0,2.0,1.0,5.0,1.0,5.0,2.0,2.0,2.0,4.0,4.0,4.0,2.0,2.0,2.0,1.0,0.0,0.0,1.0,0.0,0.0,0.0,0.0,1.0,1.0,1.0,1.0,1.0,0.0,1.0,0.0,0.0,1.0,1.0,1.0,1.0,1.0,1.0,1.0,0.0,1.0,0.0,1.0,0.0,1.0,1.0,1.0,0.0,0.0,0.0,1.0,6,5,6,6,7,6,6,7,6,7,7,"Bot,Jungle",It's great to play with people communicating,
123,32,27,Silver II,Male,Support,5108557177,1,2.0,4.0,1.0,2.0,4.0,3.0,1.0,5.0,1.0,4.0,2.0,1.0,3.0,4.0,1.0,5.0,2.0,3.0,2.0,5.0,3.0,4.0,2.0,5.0,4.0,3.0,2.0,1.0,4.0,4.0,2.0,4.0,2.0,5.0,1.0,5.0,4.0,4.0,2.0,5.0,0.0,1.0,1.0,1.0,1.0,1.0,1.0,1.0,1.0,1.0,1.0,1.0,0.0,1.0,1.0,0.0,1.0,1.0,1.0,1.0,0.0,1.0,0.0,1.0,1.0,1.0,1.0,1.0,0.0,1.0,0.0,1.0,1.0,1.0,1.0,1.0,7,7,6,6,6,6,7,7,7,6,7,"Mid,Top,Bot,Jungle","They were all honestly really nice and fun to play with. Nobody seemed tilted and everyone was very supportive and smart in their decision making. Even if mistakes were made, nobody got flamed. ",
124,33,30,Silver III,male,Mid,3786598173,1,5.0,5.0,4.0,3.0,2.0,4.0,5.0,5.0,5.0,5.0,1.0,5.0,5.0,5.0,5.0,5.0,5.0,5.0,5.0,5.0,5.0,5.0,1.0,1.0,4.0,5.0,1.0,5.0,5.0,5.0,1.0,5.0,3.0,5.0,1.0,5.0,5.0,1.0,5.0,5.0,0.0,1.0,1.0,0.0,1.0,0.0,0.0,1.0,1.0,0.0,0.0,1.0,1.0,1.0,1.0,1.0,0.0,1.0,0.0,1.0,1.0,1.0,0.0,0.0,0.0,1.0,0.0,0.0,0.0,1.0,0.0,1.0,0.0,1.0,0.0,1.0,7,7,7,7,7,7,7,7,7,7,7,"Jungle,Support",Communication is great and sense of important objectives are there,
125,33,23,Silver III,Male,Jung,3786598173,1,4.0,4.0,2.0,3.0,1.0,5.0,3.0,4.0,2.0,3.0,1.0,2.0,2.0,4.0,1.0,3.0,4.0,3.0,3.0,4.0,2.0,4.0,2.0,3.0,4.0,4.0,1.0,4.0,2.0,3.0,1.0,4.0,3.0,5.0,2.0,3.0,3.0,3.0,2.0,4.0,0.0,1.0,1.0,1.0,1.0,1.0,1.0,1.0,1.0,0.0,1.0,1.0,1.0,1.0,1.0,1.0,1.0,1.0,1.0,1.0,1.0,1.0,1.0,1.0,1.0,0.0,0.0,1.0,1.0,1.0,1.0,1.0,1.0,1.0,1.0,1.0,7,7,7,7,7,7,6,7,7,7,6,"Mid,Support","Relaxing to talk to, easy going, opinions on game seemed intelligent and unbiased.","N/A, thank you"
126,33,27,Silver I,Female,Support,3786598173,1,4.0,5.0,1.0,1.0,5.0,2.0,2.0,5.0,3.0,3.0,5.0,2.0,1.0,5.0,4.0,5.0,5.0,3.0,1.0,5.0,5.0,4.0,3.0,5.0,5.0,5.0,2.0,3.0,1.0,4.0,5.0,4.0,3.0,4.0,1.0,4.0,2.0,3.0,5.0,5.0,1.0,1.0,1.0,1.0,0.0,0.0,0.0,1.0,1.0,0.0,1.0,1.0,1.0,1.0,1.0,0.0,1.0,1.0,1.0,1.0,1.0,0.0,1.0,1.0,0.0,1.0,1.0,1.0,1.0,0.0,1.0,1.0,0.0,1.0,1.0,0.0,7,7,6,6,6,7,7,7,7,6,7,"Mid,Bot,Jungle,Support",They talked through what they expected of the other. Asking for ganking and giving valuable information on the state of their game,GL gg HF EZ
127,34,21,Gold 1,Male,Bot,5097517634,1,1.0,4.0,1.0,1.0,5.0,5.0,5.0,1.0,5.0,2.0,1.0,2.0,2.0,2.0,1.0,5.0,2.0,2.0,3.0,5.0,2.0,2.0,3.0,1.0,2.0,2.0,1.0,5.0,4.0,1.0,1.0,5.0,1.0,3.0,2.0,1.0,1.0,4.0,1.0,4.0,1.0,0.0,1.0,1.0,1.0,1.0,1.0,1.0,1.0,1.0,1.0,1.0,1.0,1.0,0.0,1.0,1.0,1.0,1.0,1.0,1.0,1.0,1.0,1.0,1.0,1.0,1.0,1.0,0.0,1.0,1.0,1.0,1.0,0.0,1.0,1.0,7,7,7,5,7,7,7,7,7,7,7,"Mid,Top,Bot,Jungle,Support",people were optimistic and did not tilt when they died or got camped by fiddlesticks. fun playing with them. a little bit of awkward silence at the start but slowly everyone got more comfortable as time went on.,
128,34,21,Gold III,Male,Support,5097517634,1,4.0,5.0,3.0,3.0,1.0,2.0,2.0,5.0,2.0,4.0,3.0,2.0,3.0,5.0,5.0,3.0,3.0,4.0,2.0,3.0,3.0,4.0,4.0,3.0,4.0,3.0,4.0,2.0,4.0,4.0,2.0,2.0,1.0,1.0,3.0,3.0,2.0,3.0,4.0,3.0,0.0,0.0,0.0,1.0,0.0,1.0,0.0,0.0,1.0,1.0,1.0,1.0,1.0,1.0,1.0,1.0,1.0,1.0,0.0,0.0,1.0,1.0,0.0,1.0,0.0,1.0,1.0,1.0,0.0,0.0,1.0,1.0,1.0,0.0,0.0,1.0,6,6,6,6,6,6,6,6,6,7,7,"Mid,Bot",,
129,34,21,Gold II,Male,Mid,5097517634,1,4.0,4.0,2.0,3.0,2.0,4.0,2.0,3.0,3.0,5.0,2.0,2.0,4.0,4.0,4.0,5.0,4.0,4.0,2.0,4.0,4.0,4.0,2.0,3.0,4.0,5.0,2.0,3.0,3.0,4.0,2.0,5.0,4.0,4.0,2.0,2.0,4.0,2.0,3.0,3.0,1.0,1.0,1.0,1.0,1.0,0.0,1.0,1.0,1.0,1.0,0.0,1.0,0.0,0.0,0.0,0.0,1.0,1.0,1.0,1.0,1.0,1.0,1.0,1.0,0.0,1.0,1.0,1.0,0.0,1.0,0.0,1.0,1.0,0.0,0.0,0.0,7,6,7,6,7,5,6,7,7,7,6,"Mid,Top,Bot,Jungle,Support","everyone played well and as a team, would be happy to do clash with them.",
130,34,20,Gold IV,Male,Top,5097517634,1,2.0,1.0,2.0,2.0,2.0,2.0,5.0,2.0,4.0,2.0,2.0,4.0,2.0,1.0,4.0,4.0,2.0,2.0,2.0,2.0,2.0,1.0,5.0,2.0,5.0,2.0,4.0,5.0,3.0,2.0,5.0,4.0,2.0,1.0,3.0,2.0,4.0,2.0,4.0,2.0,1.0,0.0,1.0,1.0,1.0,1.0,0.0,1.0,1.0,0.0,1.0,1.0,1.0,0.0,1.0,1.0,0.0,1.0,1.0,1.0,1.0,1.0,1.0,1.0,1.0,0.0,1.0,1.0,0.0,1.0,1.0,1.0,0.0,0.0,1.0,1.0,7,7,6,7,7,6,6,7,7,6,7,"Mid,Bot,Jungle","They overall seemed like very amicable and nice people, who genuinly would be fun to play with. They were also pretty good, and all worked together to try to create some synergy. No toxicity or flame of any kind made the atmosphere of the team relaxed.",It was a fun game to play!
131,34,18,Gold II,Male,Jung,5097517634,1,4.0,5.0,2.0,3.0,4.0,4.0,2.0,4.0,2.0,2.0,2.0,1.0,4.0,4.0,3.0,4.0,4.0,2.0,4.0,5.0,4.0,2.0,2.0,4.0,2.0,2.0,2.0,4.0,5.0,4.0,5.0,5.0,3.0,4.0,3.0,2.0,2.0,2.0,4.0,4.0,1.0,0.0,1.0,1.0,1.0,1.0,1.0,1.0,1.0,1.0,1.0,1.0,0.0,1.0,1.0,0.0,1.0,1.0,1.0,1.0,1.0,1.0,0.0,1.0,0.0,1.0,0.0,1.0,1.0,0.0,1.0,1.0,1.0,0.0,1.0,1.0,6,5,6,6,6,4,6,6,6,7,6,"Mid,Bot","Good players, good communication, friendly ",:)
132,35,23,Gold II,Female,Mid,5106148011,1,3.0,4.0,4.0,4.0,2.0,4.0,4.0,2.0,2.0,2.0,4.0,3.0,2.0,3.0,2.0,4.0,3.0,2.0,4.0,4.0,3.0,3.0,4.0,3.0,1.0,4.0,4.0,2.0,4.0,1.0,4.0,4.0,3.0,2.0,4.0,5.0,3.0,2.0,5.0,2.0,0.0,1.0,1.0,1.0,0.0,0.0,0.0,1.0,1.0,0.0,1.0,1.0,0.0,1.0,1.0,1.0,0.0,1.0,1.0,1.0,1.0,1.0,0.0,1.0,1.0,1.0,1.0,1.0,1.0,1.0,1.0,1.0,1.0,1.0,0.0,1.0,7,7,6,6,7,6,7,7,7,7,7,"Bot,Jungle","We seemed to synergise well with eachother and played with eachother well, especially when it came to grouping on a target or on objectives.",
133,35,28,Gold IV,Male,Bot,5106148011,1,3.0,4.0,5.0,2.0,4.0,4.0,3.0,2.0,4.0,4.0,4.0,3.0,5.0,3.0,2.0,4.0,2.0,5.0,4.0,3.0,4.0,3.0,3.0,5.0,4.0,3.0,2.0,4.0,3.0,3.0,4.0,2.0,2.0,2.0,4.0,3.0,5.0,4.0,2.0,3.0,0.0,1.0,0.0,1.0,0.0,0.0,1.0,1.0,1.0,1.0,1.0,1.0,1.0,1.0,1.0,1.0,1.0,1.0,1.0,1.0,1.0,1.0,1.0,1.0,1.0,1.0,1.0,1.0,1.0,0.0,1.0,1.0,1.0,1.0,1.0,1.0,7,7,7,7,7,7,6,6,7,7,7,"Mid,Jungle",Because they seemed to enjoy playing and they were relaxed all the time.,The enemy team surrendered at 15 min...
134,35,20,Gold IV,Male,Jung,5106148011,1,5.0,2.0,2.0,4.0,4.0,3.0,4.0,2.0,4.0,1.0,2.0,2.0,4.0,1.0,2.0,5.0,3.0,2.0,2.0,4.0,4.0,1.0,4.0,2.0,4.0,1.0,4.0,3.0,4.0,2.0,3.0,5.0,4.0,2.0,2.0,4.0,4.0,1.0,2.0,2.0,1.0,0.0,1.0,1.0,1.0,0.0,1.0,1.0,0.0,1.0,0.0,1.0,1.0,1.0,1.0,1.0,1.0,1.0,0.0,1.0,1.0,1.0,1.0,1.0,0.0,1.0,1.0,1.0,1.0,1.0,1.0,1.0,1.0,0.0,1.0,1.0,7,6,7,7,7,6,7,7,7,7,7,"Mid,Bot",We won pretty fast so it's hard to tell but everyone played well and they were fun to be around in general.,
135,36,24,Platinum III,male,Mid,3796262194,1,2.0,1.0,2.0,3.0,4.0,4.0,5.0,1.0,2.0,2.0,3.0,3.0,4.0,1.0,4.0,4.0,3.0,1.0,4.0,4.0,2.0,1.0,5.0,3.0,2.0,2.0,4.0,5.0,3.0,1.0,4.0,4.0,2.0,1.0,4.0,4.0,5.0,4.0,3.0,2.0,1.0,1.0,1.0,0.0,0.0,1.0,0.0,1.0,1.0,0.0,1.0,1.0,1.0,1.0,0.0,1.0,0.0,1.0,0.0,1.0,1.0,1.0,0.0,0.0,1.0,0.0,0.0,1.0,1.0,1.0,1.0,1.0,0.0,1.0,1.0,1.0,7,7,7,6,7,4,7,7,7,7,7,"Mid,Top,Bot,Jungle,Support","No one flamed when when mistakes were made, and people called out their own mistakes. This is a very small sample size and could have gone the other way had we lost...",
136,36,22,Platinum IV,male,Bot,3796262194,1,3.0,2.0,2.0,1.0,4.0,4.0,5.0,1.0,2.0,2.0,2.0,1.0,5.0,2.0,3.0,4.0,2.0,4.0,3.0,1.0,4.0,3.0,5.0,1.0,4.0,2.0,3.0,1.0,4.0,3.0,4.0,4.0,2.0,2.0,3.0,1.0,4.0,2.0,4.0,3.0,0.0,1.0,1.0,1.0,0.0,0.0,1.0,1.0,1.0,1.0,0.0,1.0,1.0,1.0,1.0,1.0,1.0,1.0,1.0,0.0,1.0,1.0,1.0,1.0,1.0,1.0,1.0,1.0,0.0,1.0,1.0,1.0,1.0,1.0,0.0,1.0,5,5,7,6,7,5,7,7,7,6,7,Support,very chill player for a pyke player. thats rare,
137,36,21,Platinum III,Male,Top,3796262194,1,2.0,3.0,2.0,2.0,2.0,4.0,5.0,2.0,1.0,4.0,2.0,4.0,2.0,3.0,2.0,5.0,2.0,4.0,4.0,4.0,2.0,2.0,5.0,4.0,2.0,4.0,3.0,4.0,2.0,3.0,2.0,5.0,3.0,2.0,2.0,3.0,3.0,2.0,2.0,4.0,1.0,1.0,1.0,0.0,0.0,1.0,1.0,1.0,0.0,1.0,1.0,1.0,0.0,0.0,1.0,1.0,1.0,0.0,0.0,1.0,1.0,1.0,1.0,1.0,1.0,1.0,0.0,0.0,0.0,1.0,1.0,0.0,1.0,1.0,0.0,1.0,7,7,7,7,7,7,7,7,7,7,7,"Mid,Bot,Jungle,Support","no flame, clean calls ",
138,36,18,Platinum IV,Male...,Support,3796262194,1,4.0,3.0,4.0,4.0,2.0,4.0,3.0,2.0,3.0,3.0,4.0,3.0,4.0,3.0,2.0,4.0,3.0,2.0,3.0,4.0,2.0,3.0,2.0,3.0,3.0,2.0,2.0,3.0,3.0,3.0,2.0,4.0,3.0,3.0,2.0,4.0,2.0,3.0,2.0,3.0,1.0,0.0,1.0,1.0,0.0,1.0,0.0,1.0,1.0,1.0,1.0,1.0,1.0,1.0,0.0,0.0,1.0,1.0,0.0,1.0,1.0,1.0,0.0,1.0,1.0,1.0,1.0,1.0,0.0,1.0,0.0,1.0,1.0,1.0,0.0,1.0,4,5,5,6,5,4,5,4,5,5,5,Bot,"I've tried to call out getting heralds several time, and we never got it. Mostly we pretty much ran around going for kills constantly. This game was pretty much just a completely game skill gap. If the enemy had a sense of teamwork, We probably would've lost.  There was a time when Seraphine could've catch people with her ult but she didn't...but uh....yeah. ",Chikie Tendies.
139,36,18,Silver II,Male,Jung,3796262194,1,2.0,1.0,2.0,4.0,2.0,2.0,4.0,5.0,2.0,2.0,3.0,2.0,2.0,2.0,5.0,5.0,2.0,1.0,1.0,4.0,2.0,1.0,4.0,5.0,3.0,2.0,3.0,2.0,2.0,3.0,2.0,5.0,2.0,1.0,1.0,5.0,1.0,3.0,2.0,5.0,0.0,1.0,0.0,1.0,1.0,0.0,1.0,1.0,0.0,1.0,0.0,1.0,1.0,1.0,1.0,0.0,1.0,1.0,1.0,1.0,1.0,1.0,1.0,1.0,0.0,1.0,1.0,1.0,0.0,0.0,1.0,1.0,1.0,1.0,0.0,1.0,7,6,6,6,6,6,6,7,6,6,7,"Mid,Top,Bot,Support",Idk they were chill and didn't throw my game,
140,37,31,Silver III,Male,Bot,380669599,0,5.0,5.0,2.0,1.0,4.0,5.0,1.0,4.0,4.0,5.0,2.0,5.0,4.0,5.0,3.0,4.0,4.0,4.0,4.0,4.0,4.0,5.0,1.0,4.0,2.0,5.0,3.0,4.0,4.0,4.0,2.0,4.0,4.0,4.0,2.0,4.0,4.0,4.0,4.0,5.0,1.0,0.0,1.0,0.0,1.0,1.0,0.0,1.0,1.0,1.0,1.0,0.0,1.0,1.0,0.0,1.0,0.0,1.0,1.0,1.0,0.0,1.0,1.0,1.0,1.0,0.0,1.0,1.0,1.0,1.0,1.0,1.0,1.0,0.0,1.0,0.0,7,7,7,7,7,7,6,6,6,7,7,"Top,Jungle",They were focused and just didn't complain. They just wanted to win is what I look for in league.,
141,37,21,Silver II,Male,Top,380669599,0,4.0,3.0,1.0,3.0,3.0,5.0,4.0,2.0,3.0,3.0,2.0,2.0,3.0,4.0,2.0,4.0,4.0,1.0,1.0,3.0,4.0,3.0,3.0,3.0,4.0,3.0,2.0,3.0,4.0,3.0,4.0,4.0,4.0,3.0,4.0,4.0,3.0,3.0,2.0,2.0,1.0,1.0,1.0,1.0,1.0,1.0,1.0,0.0,1.0,1.0,0.0,1.0,1.0,0.0,0.0,1.0,0.0,1.0,1.0,1.0,0.0,1.0,1.0,1.0,1.0,0.0,1.0,1.0,0.0,0.0,1.0,1.0,0.0,0.0,1.0,1.0,6,7,6,6,7,6,6,6,6,6,5,"Bot,Jungle","They seem like good guys, they're pretty skilled and have a good sense as to what they're doing. Even if they didn't play perfectly, they tried the entire time.",
142,37,18,Silver II,Male,Jung,380669599,0,2.0,1.0,2.0,4.0,2.0,2.0,4.0,5.0,2.0,2.0,3.0,2.0,2.0,2.0,5.0,5.0,2.0,1.0,1.0,4.0,2.0,1.0,4.0,5.0,3.0,2.0,3.0,2.0,2.0,3.0,2.0,5.0,2.0,1.0,1.0,5.0,1.0,3.0,2.0,5.0,0.0,1.0,0.0,1.0,1.0,0.0,1.0,1.0,0.0,1.0,0.0,1.0,1.0,1.0,1.0,0.0,1.0,1.0,1.0,1.0,1.0,1.0,1.0,1.0,0.0,1.0,1.0,1.0,0.0,0.0,1.0,1.0,1.0,1.0,0.0,1.0,6,6,5,6,6,6,6,6,7,6,6,"Top,Bot",stayed positive even though autofill support was drooling on themselves,
143,38,26,Gold IV,Male,Top,3801739884,1,5.0,3.0,1.0,3.0,2.0,4.0,3.0,3.0,2.0,4.0,2.0,4.0,5.0,5.0,2.0,4.0,4.0,3.0,2.0,4.0,4.0,4.0,2.0,4.0,2.0,4.0,3.0,4.0,4.0,3.0,4.0,4.0,4.0,4.0,1.0,4.0,4.0,4.0,4.0,5.0,0.0,1.0,1.0,1.0,1.0,1.0,0.0,1.0,1.0,1.0,0.0,0.0,1.0,1.0,1.0,1.0,1.0,1.0,1.0,1.0,1.0,1.0,1.0,1.0,0.0,1.0,1.0,1.0,0.0,1.0,1.0,1.0,1.0,1.0,0.0,1.0,6,7,7,7,7,7,7,6,7,6,7,"Jungle,Support",They were positive and played well together. Everyone was nice and considerate. We were happy playing together and no one was rude to anyone.,Thanks for having me.
144,38,19,Gold II,Male,Jung,3801739884,1,4.0,4.0,3.0,4.0,3.0,3.0,3.0,4.0,2.0,3.0,3.0,4.0,3.0,3.0,4.0,3.0,3.0,3.0,4.0,3.0,4.0,3.0,4.0,4.0,4.0,3.0,3.0,5.0,3.0,2.0,3.0,4.0,3.0,2.0,3.0,3.0,3.0,4.0,3.0,4.0,0.0,0.0,1.0,0.0,0.0,1.0,1.0,1.0,1.0,0.0,1.0,0.0,1.0,0.0,0.0,1.0,1.0,0.0,1.0,1.0,1.0,0.0,0.0,1.0,1.0,1.0,1.0,1.0,0.0,1.0,1.0,1.0,0.0,1.0,1.0,1.0,5,6,5,6,5,6,6,6,6,7,6,"Mid,Top,Jungle,Support","Not toxic, tiltproof, apologizes when they make a mistake instead of making excuses",
